<!ELEMENT OBJECTSHAPE (VERTICES,NORMALS,UVS,TRIANGLES,TEXTUREFILE)>

<!ELEMENT VERTICES (VERTEX)*>
<!ELEMENT NORMALS (NORMAL)*>
<!ELEMENT UVS (UV)*>
<!ELEMENT TRIANGLES (TRIANGLE)*>
<!ELEMENT TEXTUREFILE EMPTY>

<!ELEMENT VERTEX EMPTY>
<!ELEMENT NORMAL EMPTY>
<!ELEMENT UV EMPTY>

<!ATTLIST OBJECTSHAPE num_v		CDATA	#REQUIRED>
<!ATTLIST OBJECTSHAPE num_n		CDATA	"-1">
<!ATTLIST OBJECTSHAPE num_uv		CDATA	"-1">
<!ATTLIST OBJECTSHAPE num_t		CDATA	"-1">
<!ATTLIST VERTEX n			CDATA	#REQUIRED>
<!ATTLIST VERTEX x			CDATA	#REQUIRED>
<!ATTLIST VERTEX y			CDATA	#REQUIRED>
<!ATTLIST VERTEX z			CDATA	#REQUIRED>
<!ATTLIST NORMAL n			CDATA	#REQUIRED>
<!ATTLIST NORMAL x			CDATA	#REQUIRED>
<!ATTLIST NORMAL y			CDATA	#REQUIRED>
<!ATTLIST NORMAL z			CDATA	#REQUIRED>
<!ATTLIST UV n				CDATA	#REQUIRED>
<!ATTLIST UV x				CDATA	#REQUIRED>
<!ATTLIST UV y				CDATA	#REQUIRED>

<!ATTLIST TRIANGLE n			CDATA	#REQUIRED>
<!ATTLIST TRIANGLE v1			CDATA	#REQUIRED>
<!ATTLIST TRIANGLE v2			CDATA	#REQUIRED>
<!ATTLIST TRIANGLE v3			CDATA	#REQUIRED>
<!ATTLIST TRIANGLE n1			CDATA	"-1">
<!ATTLIST TRIANGLE n2			CDATA	"-1">
<!ATTLIST TRIANGLE n3			CDATA	"-1">
<!ATTLIST TRIANGLE uv1			CDATA	"-1">
<!ATTLIST TRIANGLE uv2			CDATA	"-1">
<!ATTLIST TRIANGLE uv3			CDATA	"-1">

<!ATTLIST TEXTUREFILE path		CDATA	#REQUIRED>
