<?xml version="1.0"?>
<!DOCTYPE OBJECTSHAPE SYSTEM "object.dtd" []>
<OBJECTSHAPE num_v="4" num_n="1" num_uv="4" num_t="2">
<VERTICES>
<VERTEX n="0" x="-1000" y="300" z="-1000"/>
<VERTEX n="1" x="1000" y="300" z="-1000"/>
<VERTEX n="2" x="1000" y="300" z="1000"/>
<VERTEX n="3" x="-1000" y="300" z="1000"/>
</VERTICES>
<NORMALS>
<NORMAL n="0" x="0" y="-1" z="0"/>
</NORMALS>
<UVS>
<UV n="0" x="0" y="0"/>
<UV n="1" x="10" y="0"/>
<UV n="2" x="10" y="10"/>
<UV n="3" x="0" y="10"/>
</UVS>
<TRIANGLES>
<TRIANGLE n="0" v1="0" v2="1" v3="3" n1="0" n2="0" n3="0" uv1="0" uv2="1" uv3="3"/>
<TRIANGLE n="1" v1="1" v2="2" v3="3" n1="0" n2="0" n3="0" uv1="1" uv2="2" uv3="3"/>
</TRIANGLES>
<TEXTUREFILE path="plaster2.bmp"/>
</OBJECTSHAPE>
